event_id,contact_id,asset_id,event_date,channel,outcome,next_action_date,owner,notes
e001,c001,scbsm_2024_01,2026-03-25,email,positive,2026-04-20,Jean,Sent a teaser on Cathedrale and received interest for a tighter asset snapshot.
e002,c003,scbsm_2024_14,2026-04-08,phone,neutral,2026-04-22,Jean,Discussed Luats and agreed to revisit after the quarter closes.
e003,c004,scbsm_2024_11,2026-04-10,phone,no_reply,2026-05-05,Jean,Tried to place Elysee Village retail but only reached voicemail.
e004,c005,scbsm_2024_08,2026-02-15,email,positive,2026-04-18,Jean,Shared a short investment note on 9 Opera and got a request for timing context.
e005,c007,scbsm_2024_18,2026-01-20,email,positive,2026-04-30,Jean,Regional buyer engaged on Graham Bell and asked for rent visibility.
e006,c008,scbsm_2024_04,2026-03-05,meeting,positive,2026-04-21,Jean,Core-office meeting on Poissonniere with clear appetite if pricing holds.
e007,c010,scbsm_2024_10,2025-11-10,email,neutral,2026-04-25,Jean,Sent Buchelay overview to a cross-border generalist mandate.
e008,c011,scbsm_2024_03,2026-04-12,linkedin,no_reply,2026-05-03,Jean,Light touch on Reaumur with no answer yet.
